{
  "schema_version": "1.0",
  "operator": "rms_norm",
  "semantic_version": "1.0",
  "inputs": [
    {"name": "x", "dtypes": ["fp16", "bf16"], "rank": 2, "layouts": ["row_major"], "alias": "none"},
    {"name": "weight", "dtypes": ["fp16", "bf16"], "rank": 1, "layouts": ["contiguous"], "alias": "none"}
  ],
  "outputs": [
    {"name": "output", "dtypes": ["fp16", "bf16"], "rank": 2, "layouts": ["row_major"], "alias": "none"}
  ],
  "parameters": {"eps": 1e-6},
  "capabilities": {"inference": true, "backward": true, "deterministic": true, "graph_capture": true},
  "numerics": {"accumulation_dtype": "fp32", "absolute_tolerance": 0.01, "relative_tolerance": 0.01, "non_finite_policy": "propagate"},
  "reference": {"provider": "torch", "entrypoint": "radeon_kernels.ops.rms_norm.reference.rms_norm_reference"}
}
